docs/src/data/stan-example.json

{
  "shape": ["triangle", "square", "circle", "square", "triangle", "square", "triangle", "circle", "circle", "square"],
  "rate": [9.8870, 0.0130, 2.9010, 7.4670, 8.5910, 9.5310, 5.8240, 4.2370, 8.3350, 8.2430]
}

docs6/src/10min.md

## Miller verbs

<pre class="pre-highlight-in-pair">
<b>mlr --icsv --ojson tail -n 2 example.csv</b>
</pre>
<pre class="pre-non-highlight-in-pair">
{
  "color": "yellow",
  "shape": "circle",
  "flag": "true",
  "k": 9,
  "index": 87,
  "quantity": 63.5058,
  "rate": 8.3350
}
{
  "color": "purple",
  "shape": "square",
  "flag": "false",
  "k": 10,
  "index": 91,
  "quantity": 72.3735,
  "rate": 8.2430
}
</pre>

## Sorts and stats

<pre class="pre-highlight-in-pair">
<b>mlr --icsv --oxtab --from example.csv \</b>
<b>  stats1 -a p0,p10,p25,p50,p75,p90,p99,p100 -f rate</b>
</pre>
<pre class="pre-non-highlight-in-pair">
rate_p0   0.0130
rate_p10  2.9010
rate_p25  4.2370
rate_p50  8.2430
rate_p75  8.5910
rate_p90  9.8870
rate_p99  9.8870
rate_p100 9.8870
</pre>

## File formats and format conversion

<pre class="pre-highlight-in-pair">
<b>mlr --json cat example.json</b>
</pre>
<pre class="pre-non-highlight-in-pair">
{
  "color": "yellow",
  "shape": "triangle",
  "flag": "true",
  "k": 1,
  "index": 11,
  "quantity": 43.6498,
  "rate": 9.8870
}
{
  "color": "red",
  "shape": "square",
  "flag": "true",
  "k": 2,
  "index": 15,
  "quantity": 79.2778,
  "rate": 0.0130
}
</pre>

## Choices for printing to files

<pre class="pre-highlight-in-pair">
<b>cat newfile.csv</b>
</pre>
<pre class="pre-non-highlight-in-pair">
color  shape    flag     index quantity rate
yellow triangle true     11    43.6498  9.8870
red    square   true     15    79.2778  0.0130
red    circle   true     16    13.8103  2.9010
red    square   false    48    77.5542  7.4670
purple triangle false    51    81.2290  8.5910
red    square   false    64    77.1991  9.5310
purple triangle false    65    80.1405  5.8240
yellow circle   true     73    63.9785  4.2370
yellow circle   true     87    63.5058  8.3350
purple square   false    91    72.3735  8.2430
</pre>